<?xml version = "1.0" encoding = "ISO-8859-1"?><!DOCTYPE application SYSTEM "dtds/application.dtd"><application name="yourapp"> 		<!-- 	A default module for each entity is assumed with the	controllers on <default-module/>	-->	<default-module>		  		<controller name="Typical"/>			</default-module>		<!-- 	You can define additional modules, for example:	  	<module name="OnlyReadTeacher">		<model name="Teacher"/>		<controller name="Print"/>	</module>			-->		<module name="InvoiceTrash">		<env-var name="XAVA_LIST_ACTION" value="Trash.restore" /> <!-- The action to be shown in each row -->		<model name="Invoice" />		<tab name="Deleted" /> <!-- To show only the deleted entities -->		<controller name="Trash" /> <!-- With only one action: restore -->	</module>	<module name="OrderTrash">		<env-var name="XAVA_LIST_ACTION" value="Trash.restore" />		<model name="Order" />		<tab name="Deleted" />		<controller name="Trash" />	</module>		</application>